Ms. 35,Heures de Jacques de Luxembourg,Milieu du 15e siècle,1440/1460,français|fre$latin|lat,parchemin,manuscrit,152 feuillets,150 x 100 mm,"Reliure 15e siècle bois, couverture veau fauve, estampée à froid de petits fers représentant des fleurs de lys, des abeilles et des lions","Au fol. 2v, on peut lire cette mention manuscrite du 16e siècle « Ces heures et livret de dévotion furent à Mgr. Jacques de Luxembourg  en son vivant chevalier et seigneur de Richebourg ». Fol. 3. Prières en français. Fol. 9. Prières en latin pour le matin et le soir. Fol. 14v, on lit : « S’ensuit la table de ce livre... ». Fol. 16v. Prière à Saint Hubert. Fol. 17. Stabat Mater. Fol. 18v. Les Sept joies de Notre-Dame. Fol. I, on lit : « Alphabetum christianurum... ». Fol. IX. Les heures de la glorieuse Magdalaine. Fol. XIV.  Les cinq Pater noster. Fol. XV. Commémorations et oraisons de plusieurs saints et saintes. Fol. XIX. Des apôtres en particulier. Fol. XXIIII. Des martyrs. Fol. XXXIII. Des confesseurs. Fol. XLVII. Des vierges. Fol. LVIII. Des trespassés. Fol. LVIIII. Oraisons diverses. Fol. LXVI, on lit : « Dévote oraison à Nostre-Dame... ». Fol. LXVIIII verso, on lit : « S’ensuit la litanie de Saint Pierre de Luxembourg... ». Fol. LXXIII, on lit : « S’ensuit dévote oraison à dire à celuy qui approche de la mort... ». Fol. IIII - XX [80], on lit : « S’ensuivent neuf aides ou remèdes lesquels Dieu nous a abaissés et enseignés... ». Fol. CVIII, on lit : « Agnus dei très noble don... ». Fol. VI - XX - XI [131] verso. Dévote commémoration du mariage de Saint Joseph et de Notre Dame. Fol. VI - XX - XII [132], on lit : «Bénédiction que le père peut faire et donner à ses enfants ». Foliotation d’origine. Texte à l’encre rouge et noir. Nombreuses petites initiales ornées d’arabesques d’or sur fond bleu, rouge ou brun. Cf. L’Histoire de Roubaix, par Th. Leuridan, T. II, 1860 ; L’Histoire de Roubaix, sous la dir. de Y. - M. Hilaire, 1984 ; Notes sur un livre d’heures de Jacques de Luxembourg, par le Chanoine Looten, dans Comité Flamand de France, premier fascicule, 1920 ; Deux livres d’heures du 15e siècle à la Bibliothèque Municipale de Roubaix, par L. Detrez, Philol et hist., 1955 - 1956. ",Isabeau de Roubaix a fait don de ce manuscrit à l’Hôpital Sainte Élisabeth de Roubaix en 1502. Il a été restitué à la Ville de Roubaix vers 1928 ,,,"Isabeau de Roubaix|Roubaix, Isabeau de",Hôpital Sainte-Élisabeth de Roubaix,,,,,,,,
Ms. 36,Poésies et chansons,Vers 1930-1940,1930/1940,français|fre,papier,manuscrit$dactylographie,235 feuillets,230 x 190 mm,Demi-reliure à coins signée Cyrille Lecoq réunissant des cahiers d’écolier,"Contient entre autres pièces : « Autobiographie humoristique » (fol. 2-27) ; « Brindilles de vie » (fol. 50-110) ; « Pasquilles et chansons en patois » (fol. 111-150) ; « Des chansons » (fol. 151-199) ; « Les Chrysanthèmes » (fol. 207-257). Contient aussi : Portrait, illustrations. Envoi de l’auteur à Robert Vandecrux. ", ,,,"Charles Barenne|Barenne, Charles",,,,,,,,,
Ms. 37,La vie est toute une chanson. Premier volume,Entre 1919 et 1937,1919/1937,français|fre,papier,manuscrit,148 feuillets,220 x 180 mm,Cahier d’écolier,"Chansons et poésie 1892-1919. Mention manuscrite de l’Archiviste municipal, 1937. Contient la table des volumes 1 et 2 (fol. A à D). Cf. aussi le Ms. 48. ",Don de l'auteur,,,"Alfred Losfeld|Losfeld, Alfred",,, ,,,,,,
Ms. 38,Papiers Auguste Victor Wacquez,Vers 1870-1880,1870/1880,français|fre,papier,manuscrit$imprimé,68 feuillets,240 x 190 mm,Demi-reliure à coins signée Dewatine,"Contient : « Méthode analytique de langue française », par A. Wacquez, 1ere partie, imprimé à Lille, par A. Degans, 1866 (fol. I-36) ; Dissertation sur la valeur littéraire et morale de quelques romans modernes, par A. Wacquez (fol. 37-58), des notes manuscrites concernant l’auteur (fol. 59), une lettre à Albert Dupuis (fol. 60-64), « Monsieur Curieux dit pourquoi », imprimé (fol. 65-67). Portr. (fol. 1v). Ex-libris manuscrit d'Albert Dupuis. ",,,,"Auguste-Victor Wacquez-Lalo|Wacquez-Lalo, Auguste-Victor",,,,,,,,,
Ms. 39,Choix de poésies et de chansons,1929-1931,1929/1931,français|fre,papier,manuscrit,235 feuillets,220 x 140 mm,Agenda,"Contient : « Brindilles de vie » (fol. 3-222 rectos) ; « Les Heures rouges » (fol. 4-70 versos) ; « Les Chrysanthèmes » (fol. 71-129 versos) ;  « Avec le sourire » (fol. 123-197 versos) ; pièces en patois (fol. 198-222 versos) ;  Charles Barenne, par Paul Gaël (fol. 233v-234). Portrait (fol. 3). Envois manuscrits de l’auteur.",Don de l'auteur,,,"Charles Barenne|Barenne, Charles",, , , ,,, ,  , 
Ms. 40,Contes d'in bacleu,Vers 1973,1963/1983 ? 1972/1974 ?,français|fre,papier,dactylographie carbone,57 feuillets (versos blancs),220 x 150 mm,Demi-reliure toile plastifiée,Double du Ms. 41.,Don de l'auteur,,,"Désiré Osson|Osson, Désiré",,,,,,,,,
Ms. 41,Contes d'un bacleu,Vers 1973,1963/1983 ? 1972/1974 ?,français|fre,papier,dactylographie,57 feuillets (versos blancs),220 x 150 mm,Demi-reliure toile plastifiée,Poèmes et anecdotes roubaisiennes. Contient des extraits de presse. Cf. aussi Ms. 40.,Don de l'auteur,,,"Désiré Osson|Osson, Désiré",,,,,,,,,
Ms. 42,Poésies,XXe siècle,1901/2000,français|fre,papier,manuscrit,92 feuillets (56-92 blancs),155 x 205 mm,Demi-reliure,Copies de poèmes de divers auteurs classiques. ,Don de Madame Jube,,,,,,,,,,,,
Ms. 43,Poésies,XXe siècle,1901/2000,français|fre,papier,manuscrit,86 feuillets,155 x 205 mm,Demi-reliure,Copies de poèmes de divers auteurs classiques. Contient des collages. ,Don de Madame Jube,,,,,,,,,,,,
Ms. 44,Recueil de chansons,XIXe siècle,1801/1900,français|fre,papier,manuscrit,69 feuillets,210 x 160 mm,Cousu,"Poèmes d'auteurs divers du 13ème au 18ème siècle, mis en musique. Texte et partition.",,,,,,,,,,,,,
Ms. 45,Livre inachevé : [poèmes et chansons],1936-1944,1936/1944,français|fre,papier,manuscrit,55 feuillets,220 x 170 mm,Cahier cousu,"Manuscrit autographe, coupures de presse. Suite du cahier « Brindilles de vie » conservé sous la cote Ms. 46. Poèmes et chansons. Portrait (fol. 1v). Cf. aussi Ms. 39 et 47. ","Ancienne collection de l’École Nationale des Arts Industriels, n° 14 961",,,"Charles Barenne|Barenne, Charles",,,,,,,,,
Ms. 46,Poésie et chansons,Vers 1935,1925/1945 ? 1934/1936 ?,français|fre,papier,manuscrit,163 feuillets,220 x 170 mm,Cahier cousu,"Contient : « Brindilles de vie » (fol. 2-84) ; « Les Chrysanthèmes » (fol. 85-115) ; « Les Heures rouges » (fol. 116-137) ; « Avec le sourire » (fol. 138-163). Contient aussi : Portrait (fol. 3, 138v) et illustration. Cf. aussi Ms. 39, 45 et 47.","Ancienne collection de l'École Nationale des Arts Industriels, n° 14 069",,,"Charles Barenne|Barenne, Charles",,,,,,,,,
Ms. 47,"Roubaix pendant l'occupation allemande, du 9 octobre 1914 au 18 octobre 1918, choses vues",1914-1918,1914/1918,français|fre,papier,manuscrit,275 feuillets,220 x 180 mm,14 cahiers d’écoliers réunis et cousus,"Manuscrit autographe. Journal et poèmes. Contient un poème de 1939 (fol. 273v). Portrait (fol. 3). Cf. aussi Ms. 39, 45 et 46.","Ancienne collection de l'École Nationale Supérieure des Arts et Industries Textiles, n° 15092.",http://www.bn-r.fr/fr/notice.php?id=MS_047,Ce manuscrit a été intégralement numérisé. Il est consultable dans la bibliothèque numérique de la Ville de Roubaix,"Charles Barenne|Barenne, Charles",,,,,,,,,
Ms. 48,La vie est toute une chanson. Second volume,1918-1937,1918/1937,français|fre,papier,manuscrit,90 feuillets,220 x 170 mm,Cahier d’écolier cousu,Mention manuscrite de l'Archiviste municipal. Cf. aussi Ms. 37.  ,Don de l'auteur,,,"Alfred Losfeld|Losfeld, Alfred",,,,,,,,,
Ms. 49,Cours de vocabulaire anglais,1917-1918,1917/1918,français|fre,papier,manuscrit,26 feuillets,160 x 100 mm,Demi-reliure toile,"Cours de vocabulaire d'anglais par Monsieur B. Brichant, appartenant à l'élève A. Lenthier, Pensionnat Saint-Louis, 2ème classe.",,,,"A. Lenthier|Lenthier, A.",,,,,,,,,
Ms. 50,Toxicologie. 2ème année,Vers 1910,1900/1920 ? 1909/1911 ?,français|fre,papier,manuscrit,206 feuillets (versos blancs),210 x 140 mm,,"Contient aussi : Liqueurs titrées, acidimétrie (fol. 154-174) ; Dosage Institut Meurice 1909-1910 (fol. 175-206). Adresse de Gaston Verse (fol. 1). Coupures de presse jointes. ","Don de Mme Masure, de Wattrelos",,,"Gaston Verse|Verse, Gaston",,,,,,,,,
Ms. 51,Histoire sommaire du Premier Régiment de Carabiniers,Entre 1860 et 1880,1860/1880,français|fre,papier,manuscrit,61 p. - 31 feuillets,190 x 150 mm,,"Contient : Relations du décès d'Agricola Viala par Léonce Werquin (fol. 1). L'histoire du Premier régiment de Carabiniers est peut-être de la main d'un parent de Léonce Werquin. Contient aussi des textes divers, poésies et chansons (fol. 7v-31).   ","Dépôt du Musée de Roubaix, n° 376",,,,,,,,,,,,
Ms. 52,Cahier journalier,1901,1901,français|fre,papier,manuscrit,38 feuillets ,225 x 170 mm,Cahier d'écolier,"Cahier d'exercices scolaires de l'École Municipale de Filles de Roubaix. Le cahier porte la mention « Fournitures gratuites de la Ville de Roubaix, édition Paul Deloffre, Landrecies, Nord. » ","Dépôt du Musée de Roubaix, n° 377",,,"Jeanne Colette|Colette, Jeanne",,,,,,,,,
Ms. 53,"La grève des saisons : fantaisies en un prologue, deux scènes et un épilogue",Vers 1930,1920/1940 ? 1929/1931 ?,français|fre,papier,dactylographie,14 feuillets,300 x 220 mm. Plié 220 x 150 mm,Couverture cartonnée,Dactylographie avec annotations manuscrites,"Dépôt du Musée de Roubaix, n° 382",,,"Jacques Bonnehon|Bonnehon, Jacques$Jacques Salève|Salève, Jacques",,,,,,,,,
Ms. 54,Six chansons inédites,1930,1930,français|fre,papier,manuscrit,10 feuillets,230 x 180 mm,"Cahier d'écolier, couverture illustrée","Chansons sur le thème de Roubaix, de l'inauguration du carillon de l'église Saint Martin et du concours organisé par la Chanson de Roubaix. Recueil dédicacé à Paul Michaux, Président des Amis de Roubaix. ",Don de Robert Vandecrux,,,"Charles Barenne|Barenne, Charles",,,,,,,,,
Ms. 55,Livret militaire,XIXe – XXe siècle,1801/2000,français|fre,papier,,34 feuillets,165 x 110 mm,,Papiers Louis Richard,Don de Paul Delannay dit Robert Henry,,,"Louis Richard|Richard, Louis",,,,,,,,,
Ms. 56,Livret de travail,XIXe – XXe siècle,1801/2000,français|fre,papier,,18 feuillets,165 x 110 mm,,Papiers Louis Richard,Don de Paul Delannay dit Robert Henry,,,"Louis Richard|Richard, Louis",,,,,,,,,
Ms. 57,Livret de saltimbanque,XIXe – XXe siècle,1801/2000,français|fre,papier,,26 feuillets,165 x 110 mm,,Papiers Louis Richard,Don de Paul Delannay dit Robert Henry,,,"Louis Richard|Richard, Louis",,,,,,,,,
Ms. 58,Papiers Louis Richard ,XIXe – XXe siècle,1801/2000,français|fre,papier,,6 feuillets ,270 x 210 mm,reliure,Papiers de famille et papiers d'affaires divers,Don de Paul Delannay dit Robert Henry,,,"Louis Richard|Richard, Louis",,,,,,,,,
Ms. 59,Lettres de Marcel Guillemyn à Charles Bodart,Vers 1961,1951/1971 ? 1960/1962 ?,français|fre,papier,manuscrit,1 feuillet ,165 x 120 mm,,Correspondance,Don de Marcel Guillemyn,,,"Marcel Guillemyn|Guillemyn, Marcel",,,,,,,,,
Ms. 60,Livre d'or d'Inch Allah,1988-1989,1988/1989,français|fre,papier,manuscrit,57 feuillets,150 x 210 mm,Emboîtage 160 x 220 mm,"Recueil des impressions des spectateurs du court-métrage « Inch Allah » de Chantal Briest et Jean-Pierre Lenoir, tourné à Roubaix. Impressions recueillies lors des diffusions au service Discothèque de la Médiathèque de Roubaix. ",,,,,,,,,,,,,
Ms. 61,Livres d'heures,XVe siècle,1401/1500,,parchemin,manuscrit,83 feuillets,170 x 120 mm,"Reliure 18e siècle basane havane, dos à nerfs orné de fleurons et de palettes, plats ornés d'un motif central de volutes et feuillages estampés à froid et encadrés d'un triple filet doré","Contient deux calendriers, l'un d'une autre main que le reste du manuscrit, de février à juillet (fol. 1-6v), l'autre de novembre à décembre (fol. 7-11v). Texte sur deux colonnes à l'encre noire et rouge comportant quelques initiales ornées à l'encre rouge et bleue. Le vélin présente des défauts sur plusieurs feuillets. De nombreux feuillets sont très jaunis et presque illisible.",Achat auprès de la Librairie Yves Vachon,,,,,,,,,,,,
Ms. 62,Compte du ménage de Madame de Brigode,1821-1825,1821/1825,français|fre,papier,manuscrit,82 feuillets,130 x 210 mm,Demi-reliure 19e siècle,"Journal des comptes du ménage du Baron Romain-Joseph de Brigode-Kemlandt, député du Nord et maire d'Annapes. Journal tenu par son épouse, tant à Annapes qu'à Paris, pour la période du 11 août 1821 au 31 décembre 1825. ",Don anonyme,,,"Romain-Joseph de Brigode-Kemlandt|Brigode-Kemlandt, Romain-Joseph de",,,,,,,,,
Ms. 63,Secours National de Croix. Réunions du Comité central,1941-1944,1941/1944,français|fre,papier,manuscrit$dactylographie,38 feuillets (21-38 blancs),220 x 180 mm,Cahier d'écolier dans une pochette cartonnée,"Compte-rendus des réunions annuelles du Comité central du Secours National de Croix du 26 mars 1941 au 28 mars 1944, de la main du secrétaire Louis Cassette. Contient la liste des membres du Comité (fol. 1-1v), des extraits de presse sur les activités du Secours national, une note manuscrite à l'adresse du secrétaire (fol. 19) et un double de courrier (fol. 20). Cahier d'écolier de l'École communale de Croix.",Dépôt de l'Association des Amis du Musée de Roubaix,,,"Louis Cassette|Cassette, Louis",,,,,,,,,
Ms. 64,Recueil de chansons,XXe siècle,1901/2000,français|fre,papier,manuscrit,54 feuillets (2 feuillets collés ? ; 38-54 blancs),220 x 170 mm,Cahier d'écolier,"Recueil de chansons populaires pour la jeunesse. Paroles et musique. Contient des indications de jeux, évolutions et mimiques à faire réaliser par des enfants. ",,,,"Marie-Louise Pont|Pont, Marie-Louise",,,,,,,,,
Ms. 65,Malkré,Fin XVIIIe siècle ou début XIXe siècle,1775/1800 ou 1801/1825,guèze|gez,parchemin,manuscrit,57 feuillets,150 x 100 mm,Reliure cuir ouvragée,"Manuscrit éthiopien d'inspiration copte rédigé en guèze. Invocations à la Vierge Marie. Constitué de deux parties : « Makléta Segé » ou « Cantique de la fleur ». Il s'agit d'une description intégrale des parties du corps de Marie, des cheveux jusqu'aux doigts de pieds. « Malkré de Saint Georges ». Le texte est composé d'une cinquantaine de strophes, commençant chacune par « Salut à... ». Le poème est une invocation à chacune des parties du corps exaltées dans ce qu'elles ont de plus remarquables. Contient douze peintures pleine page (fol. 1v-4v ; fol. 55-57) : Saint George terrassant le dragon (fol. 1v) ; La Vierge à l'enfant (fol. 2) ; L'Archange Gabriel et les trois enfants dans la fournaise (fol. 2v) ; Satan décapité par un ange (fol. 3) ; La Sainte Trinité (fol. 3v) ; Jésus de Nazareth, roi des Juifs encadré par Marie et Jean (fol. 4) ; Saint Gabra Manfas Qeddus (le serviteur de l'Esprit Saint) ; Martyre de Saint Étienne par lapidation (fol. 55) ; La Reine de Saba et le Roi Salomon (fol. 55v) ; Lors de la fuite en Égypte, la Vierge et l'Enfant encadrés par Salomé et Joseph (fol. 56) ; La Vierge sous le nom de « Kidana Mekrat » (Pacte de Miséricorde) (fol. 56v) ; Saint Abonna Takla Hàymànat (Pére, Plante de la foi) (fol. 57). ",,,,,,,,,,,,,
Ms. 66,Rouleau protecteur éthiopien,XIXe siècle,1801/1900,,parchemin,manuscrit,,2050 x 135 mm,Conditionnement dans une boite de cuir.,"Le rouleau est composé de trois bandes rassemblés ensemble et sur chaque bande figure une iconographie. En haut de la bande supérieure du rouleau, sont représentées trois parties de visages (les yeux et le nez) à l'intérieur de rectangle et ornés de bandeaux de fleurs. Sur la bande centrale, est représenté un ange ou un archange armé d'une épée (Saint Michel ou Saint Georges ?). En bas de la bande inférieure, sont représentées trois croix (le Golghota ?). Manuscrit calligraphié sur deux colonnes à l'encre noire et rouge. Rouleau restauré par l’atelier de reliure de la médiathèque en 2000.",Achat par la Médiathèque en 2000,,,,,,,,,,,,
Ms. 67,"Papiers Jean-François Collette, menuisier de Roubaix",1881-1920,1881/1920,français|fre,papier,manuscrit$imprimé,68 feuillets,170 x 110 mm,Cahier cousu sous une  couverture parchemin. Reliure avec un emboîtage ,"Livret militaire de Jean-François Collette, classe 1880, ouvrier canonnier, incorporé à divers corps d'armée stationnés à Douai de 1881 à 1906. Contient aussi une attestation des Établissements Alphonse Wagnon, datée de 1920. ",Don de Marcel Guillemyn ?,,,"Jean-François Collette|Collette, Jean-François",,,,,,,,,
Ms. 68,Droit de l'enseignement et pédagogie. Notes,Vers 1887,1877/1897 ? 1886/1888 ? ,français|fre,papier,manuscrit,"53 feuillets (7-33, 35-53 blancs ; ? découpés)",250 x 180 mm,"Cahier d'écolier, couverture toile portant la marque de l'Institut Turgot de Roubaix",Fragments des notes d'un étudiant (élève ou instituteur ?),,,,,Institut Turgot de Roubaix,,,,,,,,
Ms. 69,Livre d'or de l'exposition « Lire » 15 février - 15 mars 1972 à la Bibliothèque Municipale de Roubaix organisée par l'Association pour le développement de la lecture,15 février 1972-15 mars 1972,1972-02-15/1972-03-15,français|fre,papier,manuscrit,83 feuillets,220 x 170 mm,Cahier à spirale,Contient les remarques manuscrites des visiteurs de l'exposition (fol. 1-63),,,,,,,,,,,,,
Ms. 70,Cahier de dessin,1905-1906,1905/1906,français|fre,papier,manuscrit,13 feuillets,225 x 170 mm,Reliure toilée,"Cahier de l'élève Émile Godefroy, en cours moyen à l'École Municipale de Garçons de Roubaix, dans la classe de M. Blas. Le cahier porte sur la couverture la mention « Fournitures gratuites de la ville de Roubaix, édition Paul Deloffre, Landrecies, Nord » et sur la 4e de couverture « la Déclaration des Droits de l'Homme et du Citoyen ». ",,,,"Émile Godefroy|Godefroy, Émile",,,,,,,,,
Ms. 71,Cours d'algèbre,1941-1943,1941/1943,français|fre,papier,manuscrit,12 feuillets,225 x 175 mm,Cahier d'écolier dans un coffret en carton entoilé,"Cahier de l'élève Vanderplaetsen, classe de 1ère B, année scolaire 1941-1942, faisant partie d'un corpus comprenant deux autres cahiers sous la cote Ms 72 et Ms 73. Le cahier porte sur la couverture la mention « Ville de Roubaix. Fournitures gratuites, édition A. Druez, Landrecies, Nord » et sur la 4e de couverture « la Déclaration des Droits de l'Homme et du Citoyen ».",Don de Bernard Grelle,,,Vanderplaetsen|Vanderplaetsen,,,,,,,,,
Ms. 72,Cours d'anglais,1941-1943,1941/1943,français|fre,papier,manuscrit,42 feuillets,225 x 175 mm,Cahier d'écolier dans un coffret en carton entoilé,"Cahier de l'élève Vanderplaetsen, classe de 1ère B, année scolaire 1941-1942, faisant partie d'un corpus comprenant deux autres cahiers sous la cote Ms 71 et Ms 73. Le protège cahier est offert par la Caisse d'épargne de Roubaix. ",Don de Bernard Grelle,,,Vanderplaetsen|Vanderplaetsen,,,,,,,,,
Ms. 73,Cours de puériculture,1941-1943,1941/1943,français|fre,papier,manuscrit,18 feuillets,225 x 175 mm,Cahier d'écolier dans un coffret en carton entoilé,"Cahier de l'élève Vanderplaetsen, classe de 1ère B, année scolaire 1941-1942, faisant partie d'un corpus comprenant deux autres cahiers sous la cote Ms 71 et Ms 72. Le protège cahier est offert par la Caisse d'épargne de Roubaix",Don de Bernard Grelle,,,Vanderplaetsen|Vanderplaetsen,,,,,,,,,
Ms. 74,Souvenirs d'un appelé tourquennois incorporé au 151e RI à Metz en 1930,1930,1930,français|fre,papier,manuscrit,50 feuillets,220 x 175 mm,"Cahier, reliure toilée","Ces notes ne forment pas un journal rédigé au jour le jour, mais un récit élaboré après coup. Ce cahier retrace les six premiers mois d'incorporation de l'auteur. Il est vraisemblable qu'il en a poursuivi la rédaction sur un autre cahier. ",Don de Bernard Grelle,,,"Jules Duprez|Duprez, Jules",,,,,,,,,
Ms. 75,Cahier de géométrie,Vers 1900,1890/1910 ? 1899/1901 ? ,français|fre,papier,manuscrit,41 feuillets (20-41 blancs),220 x 170 mm,Reliure toilée,Contient des règles et exercices de géométrie (fol. 1-20).,,,,"Raymond Vanderplancke|Vanderplancke, Raymond",,,,,,,,,
Ms. 76,Recueil d'écrits sur la première guerre mondiale,Entre 1914 et 1919,1914/1919,français|fre,papier,manuscrit,33 feuillets,215 x 170 mm,Reliure toilée,"Auteur inconnu. Le cahier a pu appartenir à M. Louis Patin dont on retrouve le nom inscrit au crayon à plusieurs endroits. Fol. 1-27 : Description de quelques évènements de la première guerre mondiale : récit du bombardement de Lille ; Extrait du Bulletin des armées du 5 décembre 191? ; Éloge de la Belgique et diatribe contre Anvers. Fol. 27-29 : Extrait d'un discours de Jules Guesde. Fol. 29-29v : Discours de Viviani à la Chambre. Fol. 30-33 : Textes de chansons. Fol. 33v : Brouillon d'une lettre adressée à M. le Gérant du journal de Roubaix. Service, petites correspondances militaires. La fin de la lettre est au recto du fol. 33. Cette lettre n'est pas de la même main que le reste du manuscrit. ",,http://www.bn-r.fr/fr/notice.php?id=Ms_076,Ce manuscrit a été intégralement numérisé. Il est consultable dans la bibliothèque numérique de la Ville de Roubaix,"Louis Patin|Patin, Louis",,,,,,,,,
Ms. 77,La lecture à Roubaix dans les années [19]30. Souvenirs d'un sexagénaire,1991,1991,français|fre,papier,manuscrit,5 feuillets,210 x 150 mm,Reliure toilée,,Don de l'auteur,,,"Lucien Vercameur|Vercameur, Lucien",,,,,,,,,
Ms. 78,Carnet de la famille Dervaux,1916-1929,1916/1929,français|fre,papier,manuscrit,70 feuillets,170 x 110 mm,Couverture de moleskine noire,Le carnet est ouvert des deux côtés et comporte un texte de nature différente selon le sens de l'ouverture. Début du carnet (fol. 1-48) : Recettes de cuisine. Confiserie et pâtisserie [par Mme Dervaux]. Fol. 1-70 : Fin du carnet (folioté en remontant vers le début du carnet). Contient deux pièces probablement transcrites par M. Albert Dervaux : « Guillaume Tell » : pièce en deux actes [pour marionnettes] de Jules Watteeuw (fol. 1-42 a tergo) ; « L'esquelette » : bamboche en un acte [pour marionnettes] de Charles Bodart-Timal (fol. 43-70 a tergo). ,Don de Paul Delannay dit Robert Henry en 1993,,,"Albert Dervaux|Dervaux, Albert",,,,,,,,,
Ms. 79,L'estrade aux perroquets : roman,1944,1944,français|fre,papier,dactylographie carbone,185 feuillets (versos blancs),280 x 220 mm,"Reliure demi-peau chagrin, papier marbré, couture à la grecque, dos 5 faux nerfs. Maison C. Lecocq Reliure. Roubaix. ",Le dernier feuillet porte la mention suivante : « 22 juillet 1944 ».,Don de l'auteur,,,"Octave Vandekerkhove|Vandekerkhove, Octave",,,,,,,,,
Ms. 80,Les fauves en liberté : roman,1943,1943,français|fre,papier,dactylographie carbone,158 feuillets (versos blancs),280 x 220 mm,"Reliure demi-peau chagrin, papier marbré, couture à la grecque, dos 5 faux nerfs. Maison C. Lecocq Reliure. Roubaix. ",Dactylographie signée avec corrections manuscrites. Le dernier feuillet porte la mention suivante : « 2 janvier 1943 ».,Don de l'auteur,,,"Octave Vandekerkhove|Vandekerkhove, Octave",,,,,,,,,
Ms. 81,La bave : roman,1943,1943,français|fre,papier,dactylographie carbone,160 feuillets (versos blancs),280 x 220 mm,"Reliure demi-peau chagrin, papier marbré, couture à la grecque, dos 5 faux nerfs. Maison C. Lecocq Reliure. Roubaix. ","Dactylographie signée avec corrections manuscrites. Le dernier feuillet porte la mention suivante : « Roubaix, le 10/12/43 ».",Don de l'auteur,,,"Octave Vandekerkhove|Vandekerkhove, Octave",,,,,,,,,
Ms. 82,L'assiette au beurre : roman,1943,1943,français|fre,papier,dactylographie carbone,172 feuillets (versos blancs),280 x 220 mm,"Reliure demi-peau chagrin, papier marbré, couture à la grecque, dos 5 faux nerfs. Maison C. Lecocq Reliure. Roubaix. ","Dactylographie signée avec corrections manuscrites. Le dernier feuillet porte la mention suivante : « Roubaix, le 25 février 1943 ».",Don de l'auteur,,,"Octave Vandekerkhove|Vandekerkhove, Octave",,,,,,,,,
Ms. 83,La clique à Balthazar : roman,1944,1944,français|fre,papier,dactylographie carbone,185 feuillets (versos blancs),280 x 220 mm,"Reliure demi-peau chagrin, papier marbré, couture à la grecque, dos 5 faux nerfs. Maison C. Lecocq Reliure. Roubaix. ","Dactylographie signée. Le dernier feuillet porte la mention suivante : « Le 3 septembre 1944, alors que les Alliés entrent à Roubaix et que mon père n'est plus là pour applaudir ce beau jour... ».",Don de l'auteur,,,"Octave Vandekerkhove|Vandekerkhove, Octave",,,,,,,,,
Ms. 84,L'homme à tout faire : roman,1945,1945,français|fre,papier,dactylographie carbone,191 feuillets (versos blancs),280 x 220 mm,"Reliure demi-peau chagrin, papier marbré, couture à la grecque, dos 5 faux nerfs. Maison C. Lecocq Reliure. Roubaix. ","Dactylographie signée avec corrections manuscrites. Le dernier feuillet porte la mention suivante : « Roubaix, le 26 mars 1945 ».",Don de l'auteur,,,"Octave Vandekerkhove|Vandekerkhove, Octave",,,,,,,,,
Ms. 85,Bagnards en habit bleu : roman,1945,1945,français|fre,papier,dactylographie carbone,181 feuillets (versos blancs),280 x 220 mm,"Reliure demi-peau chagrin, papier marbré, couture à la grecque, dos 5 faux nerfs. Maison C. Lecocq Reliure. Roubaix. ","Le dernier feuillet porte la mention suivante : « Roubaix, le 24 juillet 1945 ».",Don de l'auteur,,,"Octave Vandekerkhove|Vandekerkhove, Octave",,,,,,,,,
